{
  "$schema": "https://json-schema.org/draft/2020-12/schema",
  "$id": "https://overkill-factory.dev/schemas/storybook-equivalent-catalog.schema.json",
  "title": "Overkill Factory Storybook Equivalent Catalog",
  "type": "object",
  "required": ["$schema", "record_type", "catalog_id", "created_at", "component_registry_ref", "stories"],
  "properties": {
    "$schema": { "const": "https://overkill-factory.dev/schemas/storybook-equivalent-catalog.schema.json" },
    "record_type": { "const": "storybook_equivalent_catalog" },
    "catalog_id": { "type": "string", "minLength": 3 },
    "created_at": { "type": "string", "minLength": 10 },
    "component_registry_ref": { "type": "string", "minLength": 3 },
    "stories": {
      "type": "array",
      "minItems": 3,
      "items": {
        "type": "object",
        "required": ["story_id", "component_ref", "states", "evidence_refs"],
        "properties": {
          "story_id": { "type": "string", "minLength": 3 },
          "component_ref": { "type": "string", "minLength": 3 },
          "states": { "type": "array", "minItems": 2, "items": { "type": "string", "minLength": 3 }, "uniqueItems": true },
          "evidence_refs": { "type": "array", "minItems": 1, "items": { "type": "string", "minLength": 3 }, "uniqueItems": true }
        },
        "additionalProperties": false
      }
    }
  },
  "additionalProperties": false
}
