{
  "$schema": "https://overkill-factory.dev/schemas/storybook-equivalent-catalog.schema.json",
  "record_type": "storybook_equivalent_catalog",
  "catalog_id": "product-storybook-equivalent-catalog-template",
  "created_at": "2026-06-26T00:00:00+00:00",
  "component_registry_ref": "templates/component-registry.json",
  "stories": [
    {
      "story_id": "decision-panel-default",
      "component_ref": "decision-panel",
      "states": ["ready", "submitted"],
      "evidence_refs": ["templates/operator-delivery-receipt.json"]
    },
    {
      "story_id": "status-strip-runtime",
      "component_ref": "status-strip",
      "states": ["running", "blocked", "stale"],
      "evidence_refs": ["templates/factory-status-snapshot.json"]
    },
    {
      "story_id": "evidence-table-review",
      "component_ref": "evidence-table",
      "states": ["loaded", "empty", "error"],
      "evidence_refs": ["templates/operational-evidence-bundle.json"]
    }
  ]
}
